{
  "schema_version": "1.0.0",
  "context": {
    "workspace_id": "ws-demo",
    "session_id": "session-demo",
    "run_id": "run-demo",
    "document_id": "fs-demo",
    "base_document_version": "dv-7",
    "context_snapshot_id": "ctx-7",
    "template_id": "traditional-abap-five",
    "template_version": "1.0.0"
  },
  "review_id": "tmp:review-1",
  "document_hash": "fixture-hash-dv7",
  "ruleset_version": "1.0.0",
  "recommendation": "discussion_only",
  "findings": [
    {
      "id": "tmp:finding-1",
      "rule_id": "SAP-EVIDENCE-01",
      "severity": "blocker",
      "entity_ids": [
        "verify-1"
      ],
      "description": "SAP 执行对象与事务语义尚无目标系统证据",
      "evidence_refs": [],
      "suggested_fix": "完成目标系统证据验证后重审"
    }
  ],
  "coverage": [
    {
      "rule_id": "SAP-EVIDENCE-01",
      "entity_ids": [
        "verify-1"
      ],
      "result": "fail",
      "reason": "证据缺失"
    }
  ],
  "limitations": [
    "该评审为 AI 建议，不构成人工审批"
  ]
}
